published_at,source,category,title,summary,url,market_tag,impact_hint
2026-07-13 11:11:18,SolarQuarter,Generation outlook,Singapore And Japan Sign Energy Market Cooperation Pact To Strengthen Power Sector Regulation - SolarQuarter,Singapore And Japan Sign Energy Market Cooperation Pact To Strengthen Power Sector Regulation  SolarQuarter,https://news.google.com/rss/articles/CBMiygFBVV95cUxONW5WdW9kcVcwdGY0MmZMbDQzcVI3a1pKbE4xNk5wMjBRVjVfVG1kYnprdUtaVlJtdlp1WWIxSHRlazlXLXZOUnFjM0tQOWx5cEZzMjBfUXVuMHFoNTh3NmFuRC02U0xMdGJCVDliU1Q2SmdEcVQ4U0VOYnRJM2lrN1pLT2x4aF9RR3JFZDJBVTBCV0doU3RUV0MxbFV4ZDVKd1lpVkZlMFJEdUlHbG5vSHhLSlJFS1BkMXFyaFl3Mm1hUVRZUmdFZ0NR?oc=5,Solar/Renewables,Daytime supply growth / curtailment watch
2026-06-25 00:00:00,JEPX notices,Market news,2026年度ベースロード取引市場のスケジュールを公開しました。,,https://www.jepx.jp/electricpower/outline/#schedule,Japan Power,Monitor for desk relevance
2026-06-17 07:00:00,Autonocion.com,Market news,"Japan just switched on Asia's first osmotic power plant, pulling clean electricity from the gap between fresh water and seawater nearly around the clock — a technology Norway gave up on in 2014 - Autonocion.com","Japan just switched on Asia's first osmotic power plant, pulling clean electricity from the gap between fresh water and seawater nearly around the clock — a technology Norway gave up on in 2014  Autonocion.com",https://news.google.com/rss/articles/CBMid0FVX3lxTE04TDJ1bVAzMGI0SlZfejYyM3JSVFQ1M2RGWjRjSW5seVlZZElUamlhQ1RjSm94c3VZcE12dWVaOWFpQVdEV3RfYkxzbjkwRHVRR2l6MU5fX1RaVktqZ1Q5aWlpSVNyYzl1QVNlWVljZ1dFTHBlZzFz?oc=5,Japan Power,Monitor for desk relevance
2026-05-28 00:00:00,JEPX notices,Market news,間接送電権清算書の変更について,,https://www.jepx.jp/electricpower/news/pdf/jepx20260528.pdf,Japan Power,Monitor for desk relevance
2026-04-17 00:00:00,JEPX notices,Market news,間接送電権市場 売り入札の量および価格の考え方についての資料を公開しました。,,https://www.jepx.jp/electricpower/outline/#rule,Japan Power,Monitor for desk relevance
2026-03-30 00:00:00,JEPX notices,Market news,取引規程を改定しました。,,https://www.jepx.jp/electricpower/outline/#rule,Japan Power,Monitor for desk relevance
2026-02-20 00:00:00,JEPX notices,Market news,時間前取引の停止について,,https://www.jepx.jp/electricpower/news/pdf/jepx20260220.pdf,Japan Power,Monitor for desk relevance
2026-01-14 00:00:00,OCCTO releases,Market news,Report on the Quality of Electricity Supply-Data for FY 2024,,https://www.occto.or.jp/en/information_disclosure/report_on_the_quality/of_electricity_supply_data_for_fy2024.html,Japan Power,Monitor for desk relevance
2025-11-10 00:00:00,OCCTO releases,System outlook,Outlook for Electricity Supply-Demand and Cross-regional Interconnection Lines FY 2024,,https://www.occto.or.jp/en/information_disclosure/outlook_of_electricity_supply-demand/251110_outlook_of_electricity.html,Grid/Capacity,Regional basis / adequacy watch
